{
  "canonicalTitle": "以诺：长生纪元",
  "slug": "enoch-longevity-era",
  "workType": "fiction",
  "collection": "mu-changke-fiction",
  "cover": "mu-changke-fiction-canonical-package-v1-final/covers/assets/01-enoch.jpeg",
  "editorialHook": "在一个人人追逐长寿、力量与答案的时代，一个被判定只能活到五十岁的少年，却从一块被遗忘的石碑开始，重新追问：人真正应该延长的，究竟是寿命，还是一条值得有人继续走下去的路？",
  "rightsSafeIntroduction": "《以诺：长生纪元》从一个残酷的反差开始：在长寿成为秩序、能力成为尺度的世界里，牧川偏偏是那个“无轮”的人。被判定短命、被排除在共同体的期待之外，他却在旧祖祠里遇见一个被抹去的名字，由此踏上一条不断改写自己对生命、强弱、记忆与拯救理解的道路。\n\n小说借长生世界的奇幻外壳，追问的并不只是“怎样活得更久”。它更关心：当所有人都想得到更多寿命、力量和答案时，谁还愿意记住被遗忘的人？谁愿意接住别人没有走完的路？一个人的价值，究竟由寿轮、强弱与被承认的程度决定，还是由他如何回应所领受的生命决定？\n\n这是一部关于长生的小说，也是一部不断逼近死亡、名字、责任与同行的小说。它不急着给出简单答案，而让牧川在一次次选择中学习：并不是所有人都等着被他救，有些道路真正需要的，是有人愿意记得、承接，并继续往前走。",
  "themes": [
    "生命与长寿",
    "身份与价值",
    "名字与记忆",
    "强弱与衡量",
    "死亡与承接",
    "同行与责任",
    "拯救欲与界限",
    "遗忘与守望"
  ],
  "whyRead": "如果你喜欢有完整世界观的成长型奇幻，却又希望故事不只停留在升级、力量和胜负，《以诺：长生纪元》提供的是另一种阅读方向。它把“长生”从愿望变成问题，把“强大”从答案变成需要被审视的尺度，也让一个最初因短命而羞耻的少年，逐渐面对比自己能活多久更大的事情。\n\n真正吸引人的地方，不只是牧川会遇见什么，而是他会成为什么样的人：当他越来越有能力介入别人的命运，他也必须学习什么时候伸手、什么时候停下，以及如何不把别人变成自己成长故事里的工具。",
  "readingExperience": "从“短命者”切入长生世界，开篇反差强烈。\n世界观、谜团与人物成长同步推进。\n石碑、名字、灯、道路等意象在后段逐渐形成结构性呼应。\n奇幻冒险之外保留伦理与生命问题的持续张力。\n适合喜欢慢慢发现世界规则、人物关系与深层主题的读者。",
  "biblicalCulturalNote": "书名“以诺”以及“三百六十五年”等意象与《创世记》中以诺的记载形成明确文化与圣经共鸣。但本作不是对圣经人物生平的改写，也不应被当作经文释义。小说借这一名称与“长生”母题展开文学性的想象，进一步讨论生命、同行、死亡、记忆与人的价值。",
  "authorCreativeNote": "这部作品把“人为什么想活得更久”作为世界观入口，却逐渐把问题转向“人为什么而活，以及一个人离开之后有什么值得被接住”。因此，长生不是终点，而是一面镜子：它照见人对力量、控制、答案和不肯失去的自己所怀的渴望，也照见记名、守路、同行与承接这些更安静的价值。",
  "publicationNote": "本页为作者个人网站的作品档案与原创编辑性介绍，不提供小说正文、章节连载或下载。作品的正式阅读与发行以授权平台所提供的版本为准。",
  "officialReadingCTA": "请在番茄小说或今日头条搜索《以诺：长生纪元》，作者：牧长客。",
  "rightsStatus": "AUTHOR_PORTFOLIO_EDITORIAL_DISCOVERY_LAYER",
  "editorialVersion": "AUTHOR_APPROVED_CANONICAL_RECOVERY_EDITION_v1.0",
  "editorialStatus": "LOCKED"
}
