{
  "canonicalTitle": "谁杀了先知",
  "slug": "who-killed-prophet",
  "workType": "fiction",
  "collection": "mu-changke-fiction",
  "cover": "mu-changke-fiction-canonical-package-v1-final/covers/assets/09-who-killed-prophet.jpeg",
  "editorialHook": "所有人都记住了揭露真相的记者，却没有人知道，真正把真相送到他手里的那些人是谁。",
  "rightsSafeIntroduction": "记者林然揭开了一家大型化工企业长期污染的秘密。\n\n媒体需要英雄。\n\n公众也需要一个名字。\n\n于是聚光灯自然落在林然身上。\n\n可是只有他自己知道：真正让那堵铜墙铁壁出现裂缝的，并不是一个孤胆英雄，而是许多没有留下名字的人。\n\n有人保存了一份材料。  \n有人没有销毁应该被销毁的证据。  \n有人在恐惧中做了一个很小的选择。\n\n《谁杀了先知》从调查记者与环境污染切入，却逐渐拆解一种更隐蔽的英雄主义：\n\n**历史究竟是由站在聚光灯下的人改变，还是由无数没有名字的人共同推动？**",
  "themes": [
    "真相",
    "新闻伦理",
    "环境污染",
    "无名者",
    "英雄主义",
    "良知",
    "勇气"
  ],
  "whyRead": "因为它把“英雄故事”反过来写。\n\n真正值得记住的，可能恰恰是那些历史最终没有记住名字的人。",
  "readingExperience": "调查文学\n社会现实\n新闻悬疑\n道德寓言",
  "biblicalCulturalNote": "“先知”在这里不是对某位圣经人物的直接复制，而承担“说出真相者”的文化意象。作品最终又进一步挑战了“唯一先知”的想象。",
  "authorCreativeNote": null,
  "publicationNote": "本页为作者个人网站的作品档案与原创编辑性介绍，不提供小说正文、章节连载或下载。作品的正式阅读与发行以授权平台所提供的版本为准。",
  "officialReadingCTA": "在番茄小说或今日头条搜索：\n\n**《谁杀了先知》**  \n**作者：牧长客**\n\n**前往官方平台阅读 →**",
  "rightsStatus": "AUTHOR_PORTFOLIO_EDITORIAL_DISCOVERY_LAYER",
  "editorialVersion": "v1.0",
  "editorialStatus": "LOCKED"
}
