{
  "canonicalTitle": "还有七千人",
  "slug": "seven-thousand",
  "workType": "fiction",
  "collection": "mu-changke-fiction",
  "cover": "mu-changke-fiction-canonical-package-v1-final/covers/assets/10-seven-thousand.jpeg",
  "editorialHook": "当一个人越来越相信整个时代只剩自己还在坚持，他面对的究竟是孤独——还是另一种更难察觉的试探？",
  "rightsSafeIntroduction": "程墨教了二十五年历史。\n\n他看着课堂从讨论思想、文明和终极问题，逐渐变成考点、就业率、流量、效率与即时回报。\n\n学生不再问：\n\n“这是真的吗？”\n\n他们更常问：\n\n“这个考试考吗？”\n\n临近退休，程墨越来越相信，自己可能已经成为这个时代最后一个仍愿意守住某些东西的人。\n\n可是，《还有七千人》真正要拆解的，恰恰就是这种孤独。\n\n《还有七千人》写一个老教师面对时代变化时的孤独，也写人在长期坚守中一个更隐秘的危险：\n\n**当“我仍然坚持”慢慢变成“只有我还在坚持”，忠诚与骄傲之间，究竟隔着多远？**",
  "themes": [
    "教育",
    "代际变化",
    "孤独",
    "忠诚",
    "骄傲",
    "文化记忆",
    "隐秘群体"
  ],
  "whyRead": "这篇作品尤其适合教师、牧者、知识工作者，以及任何曾经感叹“现在已经没有人关心这些了”的读者。\n\n它没有急着安慰孤独的人，而是提出一个更尖锐的问题：\n\n**当我们以为自己正在独自守护真理时，我们是否仍有勇气让自己的孤独也接受真理的审视？**",
  "readingExperience": "校园现实\n知识分子小说\n文化反思\n圣经寓言",
  "biblicalCulturalNote": "标题与列王纪上19章“七千人”的意象具有明确文化共鸣。作品借这个古老意象讨论孤独、忠诚、群体与自我认识，但网站介绍不提前解释故事最终如何回应这一意象。",
  "authorCreativeNote": null,
  "publicationNote": "本页为作者个人网站的作品档案与原创编辑性介绍，不提供小说正文、章节连载或下载。作品的正式阅读与发行以授权平台所提供的版本为准。",
  "officialReadingCTA": "在番茄小说或今日头条搜索：\n\n**《还有七千人》**  \n**作者：牧长客**\n\n**前往官方平台阅读 →**",
  "rightsStatus": "AUTHOR_PORTFOLIO_EDITORIAL_DISCOVERY_LAYER",
  "editorialVersion": "v1.1",
  "editorialStatus": "LOCKED"
}
